{
  "schemaVersion": "0.1",
  "kind": "agent-conformance-scenario",
  "scenarioId": "DISP-02",
  "capability": "disp",
  "actions": [
    {
      "ref": "action-1",
      "elementId": "approval",
      "action": "approve",
      "disposition": "permitted"
    }
  ],
  "initialState": {
    "decision": "pending",
    "mutations": 0
  },
  "requests": [
    {
      "operation": 1,
      "elementId": "approval",
      "action": "approve",
      "input": {
        "decision": "approve"
      },
      "controls": {
        "policy": "allow",
        "disposeTiming": "after_start"
      }
    }
  ],
  "sentinelInjections": [],
  "expected": {
    "discovery": [
      {
        "actionRef": "action-1",
        "risk": "consequential",
        "requiresConfirmation": false,
        "idempotency": "none",
        "inputSchemaDigest": "sha256:85e7354eafd103d9d5364af22ae9ae2951db964b69c83502a17a8e18f00a6f2c"
      }
    ],
    "outcomes": [
      {
        "operation": 1,
        "status": "succeeded",
        "previousRevisionRef": "revision-1",
        "revisionRef": "revision-2",
        "actionRef": "action-1",
        "targetPresent": true
      }
    ],
    "lifecycle": [
      {
        "operation": 1,
        "event": "action_requested",
        "outcome": "requested",
        "sequence": 1,
        "revisionRef": "revision-1",
        "actionRef": "action-1"
      },
      {
        "operation": 1,
        "event": "policy_decided",
        "outcome": "allow",
        "sequence": 2,
        "revisionRef": "revision-1",
        "actionRef": "action-1"
      },
      {
        "operation": 1,
        "event": "action_started",
        "outcome": "started",
        "sequence": 3,
        "revisionRef": "revision-1",
        "actionRef": "action-1"
      },
      {
        "operation": 1,
        "event": "action_verified",
        "outcome": "succeeded",
        "sequence": 4,
        "revisionRef": "revision-2",
        "actionRef": "action-1"
      }
    ],
    "finalState": {
      "decision": "approved",
      "mutations": 1
    },
    "perTargetOverrides": {
      "playwright-managed": {
        "outcomes": [
          {
            "operation": 1,
            "status": "failed",
            "revisionRef": "revision-2",
            "code": "stale_revision"
          }
        ],
        "lifecycle": [
          {
            "operation": 1,
            "event": "action_requested",
            "outcome": "requested",
            "sequence": 1,
            "revisionRef": "revision-1",
            "actionRef": "action-1"
          },
          {
            "operation": 1,
            "event": "policy_decided",
            "outcome": "allow",
            "sequence": 2,
            "revisionRef": "revision-1",
            "actionRef": "action-1"
          },
          {
            "operation": 1,
            "event": "action_started",
            "outcome": "started",
            "sequence": 3,
            "revisionRef": "revision-1",
            "actionRef": "action-1"
          },
          {
            "operation": 1,
            "event": "action_failed",
            "outcome": "stale_revision",
            "sequence": 4,
            "revisionRef": "revision-2",
            "actionRef": "action-1"
          }
        ]
      }
    }
  },
  "scenarioDigest": "sha256:347aad4f2b5ccb8647f511259d8d24dd44b1281360d141b5c96c0aa9b9d195fc"
}
