{
  "schemaVersion": "0.1",
  "kind": "agent-conformance-scenario",
  "scenarioId": "STALE-01",
  "capability": "stale",
  "actions": [
    {
      "ref": "action-1",
      "elementId": "approval",
      "action": "approve",
      "disposition": "permitted"
    }
  ],
  "initialState": {
    "decision": "pending",
    "mutations": 0
  },
  "requests": [
    {
      "operation": 1,
      "elementId": "approval",
      "action": "approve",
      "input": {
        "decision": "approve"
      },
      "controls": {
        "policy": "allow"
      }
    }
  ],
  "sentinelInjections": [],
  "expected": {
    "discovery": [
      {
        "actionRef": "action-1",
        "risk": "consequential",
        "requiresConfirmation": false,
        "idempotency": "none",
        "inputSchemaDigest": "sha256:85e7354eafd103d9d5364af22ae9ae2951db964b69c83502a17a8e18f00a6f2c"
      }
    ],
    "outcomes": [
      {
        "operation": 1,
        "status": "failed",
        "revisionRef": "revision-1",
        "code": "stale_revision"
      }
    ],
    "lifecycle": [
      {
        "operation": 1,
        "event": "action_failed",
        "outcome": "stale_revision",
        "sequence": 1,
        "revisionRef": "revision-1"
      }
    ],
    "finalState": {
      "decision": "pending",
      "mutations": 0
    }
  },
  "scenarioDigest": "sha256:05015391e38336b0affe4c05bf72b23598afbd2de425d0a07a64d3d2ccf55a90"
}
