{
  "schemaVersion": "0.1",
  "kind": "agent-conformance-scenario",
  "scenarioId": "CONFIRM-02",
  "capability": "confirm",
  "actions": [
    {
      "ref": "action-1",
      "elementId": "approval",
      "action": "approve",
      "disposition": "permitted"
    }
  ],
  "initialState": {
    "decision": "pending",
    "mutations": 0
  },
  "requests": [
    {
      "operation": 1,
      "elementId": "approval",
      "action": "approve",
      "input": {
        "decision": "approve"
      },
      "controls": {
        "policy": "require_confirmation",
        "confirmation": false
      }
    }
  ],
  "sentinelInjections": [],
  "expected": {
    "discovery": [
      {
        "actionRef": "action-1",
        "risk": "consequential",
        "requiresConfirmation": true,
        "idempotency": "none",
        "inputSchemaDigest": "sha256:85e7354eafd103d9d5364af22ae9ae2951db964b69c83502a17a8e18f00a6f2c"
      }
    ],
    "outcomes": [
      {
        "operation": 1,
        "status": "failed",
        "revisionRef": "revision-1",
        "code": "confirmation_required"
      }
    ],
    "lifecycle": [
      {
        "operation": 1,
        "event": "action_requested",
        "outcome": "requested",
        "sequence": 1,
        "revisionRef": "revision-1",
        "actionRef": "action-1"
      },
      {
        "operation": 1,
        "event": "policy_decided",
        "outcome": "require_confirmation",
        "sequence": 2,
        "revisionRef": "revision-1",
        "actionRef": "action-1"
      },
      {
        "operation": 1,
        "event": "confirmation_requested",
        "outcome": "requested",
        "sequence": 3,
        "revisionRef": "revision-1",
        "actionRef": "action-1"
      },
      {
        "operation": 1,
        "event": "action_failed",
        "outcome": "confirmation_required",
        "sequence": 4,
        "revisionRef": "revision-1",
        "actionRef": "action-1"
      }
    ],
    "finalState": {
      "decision": "pending",
      "mutations": 0
    }
  },
  "scenarioDigest": "sha256:43dd5e7c0a2bf609ce893f65619df5b99c304e4d77fdde0ddae2797a881cb61a"
}
