{
  "schemaVersion": "0.1",
  "kind": "agent-conformance-scenario",
  "scenarioId": "REPLACED-01",
  "capability": "replaced",
  "actions": [
    {
      "ref": "action-1",
      "elementId": "approval",
      "action": "approve",
      "disposition": "permitted"
    }
  ],
  "initialState": {
    "decision": "pending",
    "mutations": 0
  },
  "requests": [
    {
      "operation": 1,
      "elementId": "approval",
      "action": "approve",
      "input": {
        "decision": "approve"
      },
      "controls": {
        "policy": "allow"
      }
    }
  ],
  "sentinelInjections": [],
  "expected": {
    "discovery": [
      {
        "actionRef": "action-1",
        "risk": "consequential",
        "requiresConfirmation": false,
        "idempotency": "none",
        "inputSchemaDigest": "sha256:85e7354eafd103d9d5364af22ae9ae2951db964b69c83502a17a8e18f00a6f2c"
      }
    ],
    "outcomes": [
      {
        "operation": 1,
        "status": "failed",
        "revisionRef": "revision-2",
        "code": "stale_revision"
      }
    ],
    "lifecycle": [
      {
        "operation": 1,
        "event": "action_requested",
        "outcome": "requested",
        "sequence": 1,
        "revisionRef": "revision-1",
        "actionRef": "action-1"
      },
      {
        "operation": 1,
        "event": "policy_decided",
        "outcome": "allow",
        "sequence": 2,
        "revisionRef": "revision-1",
        "actionRef": "action-1"
      },
      {
        "operation": 1,
        "event": "action_failed",
        "outcome": "stale_revision",
        "sequence": 3,
        "revisionRef": "revision-2",
        "actionRef": "action-1"
      }
    ],
    "finalState": {
      "decision": "pending",
      "mutations": 0
    }
  },
  "scenarioDigest": "sha256:9421b8208128aa94f25f948dcb9fd9a58d873ffe0e45e6a035e53353f2c4ceac"
}
