{
  "schemaVersion": "0.1",
  "kind": "agent-conformance-scenario",
  "scenarioId": "REDACT-01",
  "capability": "redact",
  "actions": [
    {
      "ref": "action-1",
      "elementId": "approval",
      "action": "approve",
      "disposition": "permitted"
    }
  ],
  "initialState": {
    "decision": "pending",
    "mutations": 0
  },
  "requests": [
    {
      "operation": 1,
      "elementId": "approval",
      "action": "approve",
      "input": {
        "decision": "approve",
        "note": {
          "$sentinelRef": "sentinel-input"
        }
      },
      "controls": {
        "policy": "allow"
      }
    }
  ],
  "sentinelInjections": [
    {
      "channel": "fixture_host_input",
      "sentinelId": "sentinel-input",
      "sentinelDigest": "sha256:b4c55c7d198a8eb7ae86ebd8689ad3250a37bddc4a56c684762f7aa1b075f4f4",
      "count": 1
    }
  ],
  "expected": {
    "discovery": [
      {
        "actionRef": "action-1",
        "risk": "consequential",
        "requiresConfirmation": false,
        "idempotency": "none",
        "inputSchemaDigest": "sha256:85e7354eafd103d9d5364af22ae9ae2951db964b69c83502a17a8e18f00a6f2c"
      }
    ],
    "outcomes": [
      {
        "operation": 1,
        "status": "succeeded",
        "previousRevisionRef": "revision-1",
        "revisionRef": "revision-2",
        "actionRef": "action-1",
        "targetPresent": true
      }
    ],
    "lifecycle": [
      {
        "operation": 1,
        "event": "action_requested",
        "outcome": "requested",
        "sequence": 1,
        "revisionRef": "revision-1",
        "actionRef": "action-1"
      },
      {
        "operation": 1,
        "event": "policy_decided",
        "outcome": "allow",
        "sequence": 2,
        "revisionRef": "revision-1",
        "actionRef": "action-1"
      },
      {
        "operation": 1,
        "event": "action_started",
        "outcome": "started",
        "sequence": 3,
        "revisionRef": "revision-1",
        "actionRef": "action-1"
      },
      {
        "operation": 1,
        "event": "action_verified",
        "outcome": "succeeded",
        "sequence": 4,
        "revisionRef": "revision-2",
        "actionRef": "action-1"
      }
    ],
    "finalState": {
      "decision": "approved",
      "mutations": 1
    }
  },
  "scenarioDigest": "sha256:7de181d4bdd9f9da93d5fde7bd580160d0f07ae38e08c0dece0b1ae6d0edf226"
}
